8509750,台州市,玉环青马南大岙村宝美绿化公司
8509751,台州市,玉环青马南大岙村巨森机械厂
8509753,台州市,玉环青马南大岙村县必进机械厂
8509757,台州市,玉环青马南大岙普华自动化设备有限公司
8509777,台州市,玉环城关小普竹村岙里机械厂
8509783,台州市,玉环城关小普竹柳氏鞋厂
8509802,台州市,航空机械厂
8509803,台州市,隆中机械有限公司
8509851,台州市,玉环城关东青普力源机械厂办公楼一楼
8509852,台州市,玉环城关东青普力源机械厂门面房二楼
8509854,台州市,玉环城关沙鳝村台州华帅汽车配件公司
8509855,台州市,玉环城关沙鳝村中格机械厂
8509857,台州市,玉环城关沙鳝西路大众机械厂
8509860,台州市,玉环城关鳝湾精盾数控机床有限公司
8509863,台州市,玉环城关泽坎路搬运公司
8509888,台州市,玉环城关银丰路精捷机械有限公司
8509900,台州市,玉环城关仓兴路27号柴润燃油销售公司
8509910,台州市,玉环青马外马道外马阀门厂
8509915,台州市,玉环青马西青塘红冲厂
8509923,台州市,玉环城关采桑村安特塑胶厂胜利医疗器械
8509925,台州市,玉环城关采桑村星冠机械有限公司
8509930,台州市,玉环青马采桑村采桑东路渔富超市
8509968,台州市,玉环青马西青塘泰能砂轮有限公司
8509969,台州市,玉环青马西青塘鑫源机械公司
8509971,台州市,玉环城关龟山村阿滨超市
8509975,台州市,玉环城关龟山村锻造厂边小店
8509993,台州市,玉环城关龟山村铝合金厂
8509996,台州市,玉环城关龟山村塑料薄膜厂宿舍楼
8510001,台州市,玉环城关塘墩村塑料薄膜厂
8510002,台州市,玉环城关塘墩村台州恒博厂
8510008,台州市,玉环城关西青塘新村金亚海鲜楼对面厂房
8510009,台州市,玉环城关西青塘新村快车道汽车修理厂
8510010,台州市,玉环城关西青塘新村快车道汽车修理厂宿舍楼
8510013,台州市,玉环青马岭脚村金固玻璃有限公司
8510014,台州市,玉环青马岭脚村叶平脚手架出租公司
8510015,台州市,玉环青马西青塘宝晨机械厂
8510024,台州市,玉环青马西青塘红宝机械厂
8510026,台州市,玉环青马西青塘力蕴机械公司
8510027,台州市,玉环青马西青塘钱萍汽车配件厂
8510029,台州市,玉环青马西青塘银丰金属助剂厂
8510035,台州市,玉环城关龟山村富林塑胶厂
8510039,台州市,玉环城关龟山村新华铸钢厂
8510042,台州市,玉环城关塘墩村九山民工子弟学校
8510043,台州市,玉环城关塘墩村玉环奥瑞特公司
8510060,台州市,玉环城关九子岙村圣达软垫厂
8510073,台州市,玉环城关东青村民爆公司
8510074,台州市,玉环城关龟山纸箱厂
8510083,台州市,玉环城关东青村万家联超市
8510086,台州市,玉环城关东青巨丰工具有限公司
8509345,台州市,城中路老泰置业有限公司
8509349,台州市,城关城中路大地公司
8523861,台州市,玉环城关新城中路拥兴村镇银行
8523864,台州市,城关金鸡二路知梦服饰公司
8524178,台州市,玉环城关鼎隆时尚酒店
8524184,台州市,玉环城关天河路开元世纪贸易公司
8524199,台州市,玉环城关啤酒厂
8524204,台州市,玉环城关潭枫路玉潭机械厂宿舍
8524206,台州市,玉环城关玉潭东路易达包装厂
8524211,台州市,玉环城关国际大酒店
8524219,台州市,玉环城关玉潭路教师进修学校
8524220,台州市,玉环城关玉潭路亨国厂
8524230,台州市,玉环城关玉潭新村苏为康厂
8524308,台州市,玉环城关西青中医院
8524440,台州市,玉环城关城中路农村合作银行
8524442,台州市,玉环城关公路管理运输公司
8524512,台州市,玉环城关东山头红富士大楼台州伟业投资公司
8524522,台州市,玉环城关实验中学边阀门厂
8524524,台州市,玉环城关县东巷21号玉城兴隆餐饮有限公司
8524534,台州市,玉环城关天河路鑫泰进出口有限公司
8524535,台州市,玉环城南榴岛大道伟业投资公司
8524537,台州市,玉环城关园东巷小厂
8524572,台州市,玉环城关工商银行大楼
8524573,台州市,玉环城关长兴路金茂宾馆
8524580,台州市,玉环城关和天下投资集团有限公司
8524612,台州市,玉环城关珠城东路建设银行
8524613,台州市,城东路工商银行
8524628,台州市,玉环城关广陵路邮政银行
8524701,台州市,玉环城关羊青巷弹簧厂
8524719,台州市,城关潭枫路玉潭机械厂
8524742,台州市,玉兴西路天龙宾馆
8524756,台州市,玉环城关友谊超市
8525069,台州市,城中路华丰超市
8525155,台州市,玉环城关城中路种子公司
8525167,台州市,玉环城关南山南山红酒厂
8525175,台州市,玉环城关玉环电镀厂
8525183,台州市,南山高升眼镜配件厂
8525184,台州市,龙潭别墅旁厂房
8525191,台州市,玉环城关成人学校
8525193,台州市,玉环城关榴岛超市
8525197,台州市,玉环城关嘉汇小区圣马广告公司
8525203,台州市,榴岛大道铭车汽贸公司
8525204,台州市,实验中学新东方宾馆
8525206,台州市,天河路好多多超市
8525224,台州市,玉环城关航星机械厂
8525306,台州市,玉环城关洋青社区金属材料公司办公楼
8525318,台州市,玉环城关玉兴西路农村合作银行
8525322,台州市,玉环城关中国银行
8525364,台州市,广陵路锦环宾馆
8525371,台州市,广陵路广兴宾馆
8525374,台州市,好多多超市真味饭庄
8525376,台州市,玉环城关石井小区对面好多多超市
8525377,台州市,玉环城关玉环工程建设监理有限公司
8525383,台州市,玉环城关玉环中天工程咨询有限公司
8525384,台州市,玉环城关玉环珠港市政有限公司
8525387,台州市,玉环城关长欣宾馆
8525403,台州市,城关城中路中昌水处理设备有限公司
8525405,台州市,玉环城关城中路商业银行
8525407,台州市,华丰机房厂
8525408,台州市,罗丹玻璃厂
8525410,台州市,榴岛宾馆后厂房
8525412,台州市,阳光能源公司
8525415,台州市,锦中路海德曼机床厂
8525417,台州市,榴岛之星宾馆
8525483,台州市,城关县前路玉林宾馆
8525491,台州市,玉环城关大浪淘沙酒店
8525496,台州市,玉环城关机电公司1号住宅楼
8525497,台州市,玉环城关机电公司2号住宅楼
8525502,台州市,城关榴岛大道汽车修理厂
8525506,台州市,城关泰安路新如意汽修厂
8525522,台州市,陆通物流公司
8525527,台州市,华厦物流公司
8525533,台州市,珠港大酒店
8525535,台州市,华厦公司仓库
8526001,台州市,玉环城南李家小区财富大厦
8526002,台州市,玉环城关绿地财富中心丰铂控股有限公司
8526022,台州市,城关客运中心楼上贵州金属公司
8526023,台州市,泰安路维多利亚酒店
8526024,台州市,长治路太平洋人寿保险公司
8526042,台州市,巴黎婚纱店五楼双友机电公司
8526081,台州市,玉城中学超市
8526114,台州市,玉环城关城中路农业银行
8526189,台州市,玉环城关标准件厂
8526198,台州市,华孚彩色包装有限公司宿舍楼
8526365,台州市,玉环城关振兴阀门厂
8526366,台州市,城关玉兴西路老酒厂
8526411,台州市,新世纪宾馆
8526497,台州市,长治路方正证券有限公司
8526498,台州市,绿地一品中国民生银行
8526502,台州市,东风大酒店
8526503,台州市,台州元丰投资有限公司
8526504,台州市,玉环城关新花色房产公司四单元
8526517,台州市,东风假日大酒店9楼
8526519,台州市,城关今日广告公司
8526520,台州市,金色阳光假日酒店
8526651,台州市,玉环城关中医院
8526653,台州市,玉环城关中医院宿舍楼
8526695,台州市,玉环城关玉环宾馆
8526703,台州市,建宇建设有限公司
8526705,台州市,锦元巷教育局印刷厂
8526709,台州市,玉环城关玉环宏鑫凸轮厂
8526716,台州市,玉环城关康育南路2号民泰商业银行
8526724,台州市,康育南路洋青大厦一楼三江超市
8526733,台州市,洋青大厦农村合作银行
8526778,台州市,城关三江超市
8526787,台州市,玉环宾馆
8526789,台州市,中国农业银行
8526792,台州市,玉环城关金龙宾馆
8526793,台州市,玉环大酒店宿舍楼
8526796,台州市,金龙宾馆
8526816,台州市,京都宾馆
8526817,台州市,平安宾馆
8526819,台州市,华峰宾馆
8526831,台州市,兴隆宾馆
8526832,台州市,凯悦宾馆
8526834,台州市,博海进出口公司
8526842,台州市,宏大宾馆
8526843,台州市,朋来宾馆
8526847,台州市,玉环城关17号小区红太阳宾馆
8526848,台州市,玉环城关17号小区温馨宾馆
8528733,台州市,玉兴宾馆
8528734,台州市,豪华宾馆
8528735,台州市,南方宾馆
8530720,台州市,人民医院住院部12楼
8536204,台州市,街头村坞根供水分公司
8536243,台州市,街头村长江水道管件厂
8537646,台州市,寺基村温岭市鑫茂机电有限公司
8537677,台州市,陈军电机配件厂
8537680,台州市,横山黄湾龙皇水产开发公司
8537697,台州市,坞根下呈村劳士顿新厂内
8537763,台州市,下呈工业区亿客隆超市
8537766,台州市,下呈仁木工具厂
8540191,台州市,康明斯对面新建厂房
8540193,台州市,台州恒跃新能源科技公司
8540227,台州市,团塘光磊齿条厂
8540229,台州市,浙江美机缝纫机有限公司
8540230,台州市,中厢草编厂
8540239,台州市,中厢村东大精密公司
8540240,台州市,中厢村东晓印务厂
8540242,台州市,中厢村联华超市
8540244,台州市,合作银行新河塘下下张分理处
8540358,台州市,华跃工贸有限公司
8544676,台州市,玉环陈屿龙山路科锐纺机械配件有限公司
8544680,台州市,玉环陈屿陈北村台州宝龙公司
8544681,台州市,玉环陈屿眼镜园宝龙公司
8544682,台州市,玉环陈屿陈北村海荣中联锻造厂
8544685,台州市,玉环陈屿陈北村兴达公司
8545395,台州市,城关玉环东风大酒店
8546646,台州市,西湾村盛源新厂房楼顶
8546648,台州市,泽国荣光机械厂
8546692,台州市,陈家里太阳能厂后面新建房
8546736,台州市,泽国丹山村轮毂厂
8546737,台州市,泽国丹山旭田机电有限公司
8546739,台州市,泽国株松村正松水泵厂
8546743,台州市,鑫磊公司
8546824,台州市,筻头村A区1号旁厂房
8546864,台州市,筻头村南冠办公公司
8546869,台州市,浙江大世纪泵业有限公司
8546942,台州市,山坑村天成摩托车零部件有限公司
8546952,台州市,鑫都机械厂
8546953,台州市,皇泰电机有限公司宿舍
8546984,台州市,兴益风机新厂区员工宿舍楼
8546985,台州市,兴益控股新厂区北首新厂房
8546988,台州市,泽国东村村部出租厂房
8546989,台州市,泽国筻头村兴益风机有限公司
8546992,台州市,泽国上洋锡钢片厂宿舍楼
8547005,台州市,台州凯凯工具制造有限公司
8547006,台州市,天皇B区庙西北厂区
8547081,台州市,天皇村厂房
8547084,台州市,天皇村大元压铸有限公司宿舍楼
8547126,台州市,田洋里煤气公司对面新建屋
8547184,台州市,温岭市联通电机有限公司
8547187,台州市,猎豹压缩机制造公司
8547229,台州市,中西医结合医院
8547755,台州市,箬横盘马老砖窑厂边新厂
8547972,台州市,箬横三鑫车业有限公司
8548031,台州市,箬横田后村学校南面边厂房
8548055,台州市,箬横圣爱达机械附件厂
8548120,台州市,箬横下墩亚派克机电公司
8548227,台州市,山前小学边海兵机械厂
8548283,台州市,箬横谢家天赐养鸡厂
8548297,台州市,下朱村厂房
8548298,台州市,庄联村352号北侧厂房
8548719,台州市,城关农场台州气门厂
8549025,台州市,城关农场台州气门厂
8549147,台州市,城关农场台州气门厂
8552674,台州市,横山前陈家村三和超市
8552796,台州市,新屋村2队锻打厂宿舍楼
8560517,台州市,太平北山聋哑学校
8560997,台州市,城乡房屋开发公司宿舍
8565018,台州市,银海宾馆
8565106,台州市,太平东方罗马商务宾馆
8565114,台州市,邮政大厦A区
8565115,台州市,邮政大厦B区
8565144,台州市,前溪路食品总公司
8565350,台州市,宝兴宾馆
8565392,台州市,扁屿村翻沙厂后墙
8565707,台州市,保塔南路液化气公司
8565712,台州市,钱江摩托车厂内
8565713,台州市,太平保塔南路煤气公司62幢
8569049,台州市,锦昌商厦北幢
8569054,台州市,万昌中路宏兴宾馆完美酒店
8570020,台州市,金太阳酒店
8570028,台州市,天城机床边恒力公司
8570038,台州市,星火机电厂
8570339,台州市,工成机电有限公司
8570343,台州市,开拓工具厂
8570406,台州市,西湾村C区开拓工具厂
8570407,台州市,西湾村高峰水泵厂
8570412,台州市,西湾林祥工贸公司
8571026,台州市,山南村网点对面新建厂房
8571060,台州市,亿利达鞋厂南幢宿舍楼
8571061,台州市,泽国浙诺尔新厂
8571070,台州市,鼎兴轴承厂
8571087,台州市,桥伍扳手厂
8571098,台州市,桥伍村东田电器厂
8571185,台州市,泽国桥伍纸箱厂
8571813,台州市,雅梦制衣厂
8571824,台州市,岸里村工艺品厂
8571825,台州市,台州赛发网业有限公司
8571828,台州市,岸里村织网厂
8571830,台州市,拓安机电公司
8571835,台州市,环球五金厂
8571836,台州市,华丽家具厂
8571847,台州市,大桥头村天成家具厂
8571858,台州市,横河陈村磁钢厂
8571860,台州市,华普印刷厂
8571863,台州市,下洋潘村塑料厂
8571867,台州市,华鹏机械厂
8571873,台州市,腾远机械厂
8571874,台州市,天骄缝纫机厂
8571875,台州市,尚胜娱乐公司
8571876,台州市,名扬缝纫机厂
8571878,台州市,嘉乐达塑胶有限公司
8571879,台州市,宏越汽修厂
8571977,台州市,下陈岸里村家具厂
8571983,台州市,南岸里村家具厂
8571984,台州市,南岸里村键配厂
8571985,台州市,南岸里村脚手架公司
8571986,台州市,南岸里村起重机厂
8571987,台州市,南岸里村水厂办公楼
8571988,台州市,南岸里村水厂车间
8571989,台州市,南岸里村水厂机修间
8571990,台州市,南岸里村水厂配电房
8571991,台州市,南岸里村塑料厂
8571994,台州市,南岸里村印花厂宿舍
8571995,台州市,椒南水厂
8572004,台州市,日山份村创业汽修厂
8572008,台州市,日山份村利鼎铜老公司
8572009,台州市,日山份村馒头加工厂
8572013,台州市,日山份村制衣厂
8572014,台州市,日山份村租赁公司
8572016,台州市,马克电子公司
8572023,台州市,凡宏彩印厂
8572024,台州市,中海服装厂
8572025,台州市,海特橡胶厂
8572035,台州市,浙江百达精工公司
8572037,台州市,开发大道改板厂
8572040,台州市,浙江集晟科技公司
8572041,台州市,浙江凯德科技股份有限公司
8572042,台州市,君泰汽车服务有限公司
8572043,台州市,立合知识产权公司
8572044,台州市,新乐公司
8572045,台州市,长昌电子商务有限公司
8572046,台州市,台州移动公司
8572047,台州市,红樱桃家俱厂
8572048,台州市,百富的公司
8572056,台州市,台州市祥龙包装科技有限公司
8572057,台州市,万邦公司
8572058,台州市,水产综合厂
8572059,台州市,新中九公司
8572060,台州市,喜加喜公司
8572061,台州市,神龙包装厂
8572062,台州市,马格变压器厂
8572063,台州市,金桥修理厂
8572064,台州市,新乐羊毛衫厂
8572065,台州市,海特橡塑厂
8572066,台州市,奥尔琪公司
8572067,台州市,中九公司
8572068,台州市,兴纬纺织机械厂
8572069,台州市,聚宝盒公司
8572070,台州市,上海电梯咨询公司
8572071,台州市,大宇酒店设备厂
8572073,台州市,百达精工公司
8572093,台州市,绿驹电动车厂
8572095,台州市,沙北村拉丝厂
8572100,台州市,机场路好来购服装超市
8572109,台州市,沙北村服装厂
8572120,台州市,机场路路口小工厂
8572173,台州市,陈洪村制桶厂
8572296,台州市,海圆机械厂
8572297,台州市,渠东村电动三轮车厂
8572471,台州市,宏欣汽车修理厂
8572472,台州市,椒江顺利汽车修理厂
8572477,台州市,后徐新村汽修厂
8572478,台州市,灵江公司
8572480,台州市,椒渔船舶机械厂
8572481,台州市,台州文华学校
8572482,台州市,忆生宾馆
8572564,台州市,新骆航海有限公司
8572573,台州市,当角村凯迪塑料制品厂
8572574,台州市,当角村煤球厂
8572575,台州市,当角村万鑫门厂
8572580,台州市,宏兴建筑工程公司
8572614,台州市,辉日橡胶厂
8572616,台州市,乐斯泰电子厂
8572618,台州市,世金机械厂
8572620,台州市,台州世金塑胶机械有限公司
8572621,台州市,台州志成实业公司
8572622,台州市,台州志诚实业公司1号车间
8572623,台州市,台州志诚实业公司2号车间
8572624,台州市,台州志诚实业公司3号车间
8572625,台州市,台州志诚实业公司4号车间
8572626,台州市,台州志诚实业公司5号车间
8572627,台州市,台州志诚实业公司6号车间
8572628,台州市,信华公司
8572629,台州市,兴浪摩托配件厂
8572632,台州市,杭州联华华商集团有限公司
8572644,台州市,牛轭大理石厂
8572645,台州市,喜加喜公司
8572646,台州市,牛轭小区北兴友塑料厂
8572650,台州市,牛轭桥酒店
8572651,台州市,九鼎公司宿舍楼
8572757,台州市,宏鼎公司二分厂
8572759,台州市,锦欧机械厂
8572760,台州市,浙江泰克斯林网业有限公司
8572762,台州市,九鼎公司
8572763,台州市,九鼎公司别墅
8572764,台州市,合作村新厂房
8572765,台州市,雅梦公司
8572816,台州市,大众一次性杯厂
8572817,台州市,水压泵厂
8572818,台州市,台州纺织器材厂
8572820,台州市,东太和路101号东厂房
8572824,台州市,台州市银河变压器有限公司
8572825,台州市,馨芷轩日用品有限公司
8572826,台州市,明天礼品公司
8572827,台州市,台州市宏太实业公司
8572829,台州市,恒剑玻璃工艺品厂
8572831,台州市,定向反光材料厂
8572836,台州市,恒信日用品厂
8572838,台州市,融金印务公司
8572839,台州市,瑞达公司
8572840,台州市,瑞达机械厂
8572842,台州市,润升有限公司
8572843,台州市,伸顺电机厂
8572846,台州市,台州纺织机械厂
8572847,台州市,台州恒翔针业有限公司
8572850,台州市,腾际日用品公司
8572851,台州市,新水晶电子公司
8572852,台州市,银河电气公司
8572853,台州市,浙江辰泰公司
8572855,台州市,国信物流设备厂
8572856,台州市,奥搏机电厂
8572864,台州市,新厦光漆涂料厂
8572865,台州市,浙江厦光涂料有限公司
8572866,台州市,德龙公司
8572867,台州市,海门真空设备厂
8572868,台州市,汇美公司
8572869,台州市,台州市宏迪塑料制品厂
8572870,台州市,伟星模具厂
8572872,台州市,浙江爱思尼有限公司
8572875,台州市,浙江国商实业股份有限公司
8572876,台州市,旭田包装机械厂
8572877,台州市,台州市绿科工贸有限公司
8572878,台州市,椒江普力慈克节能科技公司
8572882,台州市,巨泰汽车配件公司
8572883,台州市,科瑞印务有限公司
8572886,台州市,疏港大道汽压泵厂
8572887,台州市,台州艾裴建材有限公司
8572888,台州市,台州市旭田包装厂
8572889,台州市,台州市伊林塑胶厂
8572890,台州市,台州市亿莱德空调设备公司
8572891,台州市,台州市瑜谦实木家具公司
8572893,台州市,亿旺食品机械公司
8572894,台州市,浙江简姿家具有限公司
8572895,台州市,恒信日用品有限公司
8572897,台州市,浙江爱思尼环保科技有限公司
8572900,台州市,热电厂南边工地临时房
8572904,台州市,富康床上用品有限公司
8572906,台州市,打钉厂
8572907,台州市,强鹰公司
8572908,台州市,八仙官钢管厂
8572909,台州市,亿莱德空调设备公司
8572913,台州市,文峰油墨隔壁电镀厂
8572915,台州市,浩宇电镀厂
8572916,台州市,台州热电厂
8573149,台州市,铸造材料厂
8573157,台州市,台州市公共交通集团有限公司
8573329,台州市,海城头皮鞋厂
8573332,台州市,海城头富康公司厂房
8573333,台州市,利伟电线厂
8573335,台州市,中凯涂料厂
8573336,台州市,西厦光漆厂
8573339,台州市,民辉村酒厂
8573340,台州市,民辉村洁具厂
8573347,台州市,前进电机厂
8573348,台州市,台州市利格机械有限公司
8573487,台州市,杰威公司
8573488,台州市,东辉村灯具厂
8573489,台州市,东港包装用品厂
8573490,台州市,东辉村东升灯具厂
8573598,台州市,世纪联华超市
8573599,台州市,鑫艺宾馆
8573602,台州市,标龙缝纫机厂
8573605,台州市,世纪联华超市店铺
8575052,台州市,104国道前岙洋村厂区
8578601,台州市,楚门龙王村恒泰金属厂
8578611,台州市,楚门中山村老方向盘厂
8578614,台州市,楚门中山村台州意顺阀门有限公司
8578688,台州市,楚门龙王村中山电镀厂
8580584,台州市,黄岩城区桔乡大道12号1幢
8580585,台州市,黄岩城区桔乡大道14号1幢
8580586,台州市,黄岩城区桔乡大道16号1幢
8584763,台州市,中央坑里厂
8584764,台州市,中央坑里厂自然村
8588170,台州市,宝元汽车公司
8588175,台州市,华夏汽修厂
8588184,台州市,隆嘉汽车销售有限公司
8588185,台州市,铝塑窗厂门品杆
8588191,台州市,五菱汽车修理厂
8588197,台州市,正龙汽车销售有限公司
8588198,台州市,自选超市
8588878,台州市,玉环陈屿古城工具厂
8588879,台州市,玉环陈屿古城李兴兴超市
8588881,台州市,玉环陈屿陈岙里村古城金属异型材料厂
8588883,台州市,玉环陈屿新园村里墩水厂门卫
8588884,台州市,玉环陈屿中浦阀门厂
8588885,台州市,玉环陈屿陈岙里博士眼镜厂
8588886,台州市,玉环陈屿古城金属厂
8588887,台州市,玉环陈屿新园村里墩水厂办公楼
8588952,台州市,玉环陈屿陈屿陈岙里大永发厂
8588953,台州市,玉环陈屿陈屿大永发眼镜厂
8588958,台州市,玉环陈屿陈岙里玉环飞挺机械有限公司
8588960,台州市,玉环陈屿陈屿陈岙里大永发眼镜厂
8588961,台州市,玉环陈屿陈岙里村大远发公司
8589072,台州市,玉环陈屿变电所边中捷公司对面新建房
8589074,台州市,玉环陈屿变电所边中捷公司
8589075,台州市,玉环陈屿环峰路佳联超市
8589082,台州市,玉环陈屿陈屿岗仔头第三化工机械厂
8589085,台州市,玉环陈屿陈屿岗仔关头德汽配厂
8589090,台州市,玉环陈屿陈屿岗仔头低箱厂
8589092,台州市,玉环陈屿岗仔头欧凯超市
8589148,台州市,裕盛模塑有限公司
8589154,台州市,黄涛精密铸造厂
8589158,台州市,立泰公司锦川路268号
8589172,台州市,绿活路农村合作银行
8589173,台州市,三普模塑有限公司
8589179,台州市,轩汉模塑有限公司
8589700,台州市,坑郑天旺冲床厂
8589704,台州市,坑郑村万康清洁公司
8589705,台州市,坑郑宇帆弯管厂
8589724,台州市,彭家宅宏恩阀门有限公司
8589735,台州市,田岙村南方调剂厂
8589736,台州市,田岙村尚仕沙发厂
8589738,台州市,田岙村田岙超市
8589746,台州市,田岙联达手轮厂
8589747,台州市,田岙万众阀门厂
8590296,台州市,黄土岭煤气公司
8592823,台州市,路桥西路桥大道汉庭酒店
8592824,台州市,路桥西路桥大道豪都酒店
8592826,台州市,路桥马铺路友谊装饰有限公司
8592827,台州市,路桥马铺路君毅小宾馆酒店联盟
8592828,台州市,路桥马铺路露慧小宾馆
8592829,台州市,路桥马铺路峰西小宾馆酒店联盟
8592833,台州市,路桥马铺路园丁宾馆
8592834,台州市,路桥西路桥大道一定好宾馆
8592835,台州市,路桥银安北街都市宾馆
8592836,台州市,路桥西路桥大道270号沪宾宾馆
8592837,台州市,路桥西路桥大道万豪宾馆
8592839,台州市,路桥西路桥大道五洲宾馆
8592840,台州市,路桥大道谷丰宾馆
8592841,台州市,路桥西路桥大道昌盛旅馆酒店联盟
8592842,台州市,路桥马铺路金良小宾馆酒店联盟
8592843,台州市,路桥马铺路便民旅馆酒店联盟
8592844,台州市,路桥大道瑜园宾馆
8592846,台州市,路桥银安街帕菲克风情酒店
8592868,台州市,路桥樱花路799号易得利文化用品有限公司
8592869,台州市,路桥樱花路799号易得利工贸有限公司
8592870,台州市,路桥樱花路华夏仓储设备有限公司
8592871,台州市,路桥樱花路路桥机械五金电镀厂
8592874,台州市,路桥灵山街中鹏制衣有限公司
8592875,台州市,路桥灵山街海马重型模锻厂东南角宿舍
8592876,台州市,路桥灵山街246号玲玲漆汽修厂
8592878,台州市,路桥灵山街怡开包装公司
8592882,台州市,路桥灵山街企鹅冷冻厂
8592884,台州市,路桥新安西街台州凯达制冷有限公司
8592885,台州市,路桥新安西街八环轴承厂
8592886,台州市,路桥新安西街八环轴承厂宿舍楼
8592888,台州市,路桥新安西街迅通汽车有限公司
8592889,台州市,路桥新安西街凯达制冷有限公司
8592890,台州市,路桥新安西街申浙汽车有限公司
8592891,台州市,路桥新安西街申浙汽车销售有限公司宿舍
8592892,台州市,路桥银安街海马重型模锻厂员工宿舍
8592893,台州市,路桥墙里贺海马重型模具有限公司
8592895,台州市,路桥墙里贺易得利工贸有限公司
8592896,台州市,路桥新安西街699号鑫源房地产公司
8593039,台州市,路桥蓬街蓬西村宏特塑料制品厂
8593043,台州市,路桥蓬街幸福村台州鸿球洁具厂
8593046,台州市,路桥蓬街加惠村台州市鑫晨电动车有限公司
8593051,台州市,路桥蓬街加惠村2区船锚厂
